Video Title,Thumbnail URL,View Count,Channel Name,Published Date
Shri Ram Lalla Pran Pratishtha LIVE | PM Modi attends Pran Pratishtha of Shri Ram in Ayodhya,https://i.ytimg.com/vi/xBwfbsv3WjU/mqdefault.jpg,10552522,Narendra Modi,2024-01-22T10:13:36Z
PM Modi LIVE | Ayodhya Ram Mandir LIVE | Shri Ram Lalla Pran Pratishtha,https://i.ytimg.com/vi/EU4fJn0YdXw/mqdefault.jpg,10745464,Narendra Modi,2024-01-22T10:34:31Z
"Ayodhya Ram Mandir: राम मंदिर पहुंचे PM Modi, देखिए Pran Pratishtha से पहले क्या किया | Aaj Tak",https://i.ytimg.com/vi/IC0M3UsybPw/mqdefault.jpg,3737421,Aaj Tak,2024-01-22T07:00:10Z
"Ayodhya Ram Mandir: Ramlala के दर्शन कर Jackie Shroff, Ayushmann Khurrana जैसे दिग्गज क्या बोले?",https://i.ytimg.com/vi/P8zfsBnWK6U/mqdefault.jpg,2338620,NDTV India,2024-01-22T12:12:13Z
My BROTHER babysits our BABY for 24 HOURS 😱,https://i.ytimg.com/vi/3lS6leJG35Q/mqdefault.jpg,1613289,Wanderers Hub,2024-01-22T09:00:09Z
